{
  "id": "session-flow",
  "description": "Claim sync (sets KV on bd close for memory gate), stop gate (blocks agent stop with unclosed in_progress claim), xt end reminder when session ends in a worktree.",
  "version": "1",
  "runtime": "both",
  "order": 19,
  "claude": {
    "hooks": [
      {
        "event": "PostToolUse",
        "matcher": "Bash|execute_shell_command|bash",
        "command": "node ${CLAUDE_PLUGIN_ROOT}/hooks/beads-claim-sync.mjs",
        "timeout": 5000
      },
      {
        "event": "Stop",
        "command": "node ${CLAUDE_PLUGIN_ROOT}/hooks/beads-stop-gate.mjs",
        "timeout": 5000
      }
    ]
  },
  "pi": {
    "extension": "packages/pi-extensions/extensions/session-flow/index.ts",
    "events": ["tool_result", "agent_end"]
  }
}
