{
  "id": "gitnexus",
  "description": "Trigger GitNexus auto-augmentation after Bash, Grep, Read, Glob, and Serena code edits.",
  "version": "1",
  "runtime": "claude",
  "order": 40,
  "claude": {
    "hooks": [
      {
        "event": "PostToolUse",
        "matcher": "Bash|Grep|Read|Glob|mcp__serena__find_symbol|mcp__serena__get_symbols_overview|mcp__serena__search_for_pattern|mcp__serena__find_referencing_symbols|mcp__serena__replace_symbol_body|mcp__serena__insert_after_symbol|mcp__serena__insert_before_symbol|mcp__serena__rename_symbol",
        "command": "node ${CLAUDE_PLUGIN_ROOT}/hooks/gitnexus/gitnexus-hook.cjs",
        "timeout": 10000
      }
    ]
  }
}
