{
  "id": "quality-gates",
  "description": "Run project quality checks (lint/typecheck) after mutating file edits. Invokes .claude/hooks/quality-check.cjs (TS/JS) or quality-check.py (Python) via PostToolUse tool_result.",
  "version": "1",
  "runtime": "pi",
  "order": 30,
  "pi": {
    "extension": "config/pi/extensions/quality-gates.ts",
    "events": ["tool_result"]
  }
}
